{
  "schema_version": 1,
  "event_uuid": "018f-example-event-0001",
  "device_id": "esp32_01",
  "boot_id": "boot-018f-example-0001",
  "device_uptime_ms": 12345,
  "event_sequence": 7,
  "event_type": "fall_detected",
  "occurred_at_device": "2026-09-02T00:00:00.000Z",
  "clock_quality": "synced",
  "detector_version": "threshold_fsm_v2_time_features_v1",
  "mode": "normal",
  "confidence_status": "not_available",
  "evidence": {
    "decision_source": "edge",
    "features": {
      "accel_peak_g": 3.74,
      "gyro_peak_dps": 182.5,
      "orientation_delta_deg": 52.0,
      "immobility_observed_ms": 2000
    },
    "sample_bundle": null
  }
}
